image_id,class_name,nombre_imagen,numero_imagen,carpeta_origen,imagen,clase_real,clase_real_patologo,clase_predicha_raw,clase_predicha,probabilidad,image_caption_blip_raw,image_caption_blip,caption_blip_util,blip_cues_json,class_prototype_morphology_json,class_prototype_caption,morphology_v2_json,caption_v2_vlm,hybrid_weak_caption,error_tipo,error_msg
PROMYELOCYTE_864864,Myelocyte,PROMYELOCYTE_864864.jpg,PROMYELOCYTE_864864,ig,/content/drive/MyDrive/TFM/blood-cell-vllm/imagenes/ig/PROMYELOCYTE_864864.jpg,promyelocyte,PROMYELOCYTE,myelocyte,myelocyte,0.766019,A purple substance in a white background.,A purple substance in a white background.,0,{},"{""cytoplasm_amount"": ""undefined"", ""cytoplasm_color"": ""undefined"", ""granulation"": ""undefined"", ""inclusions"": ""undefined"", ""nuclear_chromatin"": ""undefined"", ""nucleocytoplasmic_ratio"": ""undefined"", ""nucleoli"": ""undefined"", ""nucleus_segments"": ""undefined"", ""nucleus_shape"": ""undefined"", ""size"": ""undefined"", ""villi"": ""undefined""}",A Myelocyte cell.,"{""confidence"": {""cytoplasm_amount"": 0.4, ""cytoplasm_color"": 0.4, ""granulation"": 0.4, ""inclusions"": 0.4, ""nuclear_chromatin"": 0.4, ""nucleocytoplasmic_ratio"": 0.4, ""nucleoli"": 0.4, ""nucleus_segments"": 0.4, ""nucleus_shape"": 0.4, ""size"": 0.4, ""villi"": 0.4}, ""cytoplasm_amount"": ""undefined"", ""cytoplasm_color"": ""undefined"", ""granulation"": ""undefined"", ""inclusions"": ""undefined"", ""nuclear_chromatin"": ""undefined"", ""nucleocytoplasmic_ratio"": ""undefined"", ""nucleoli"": ""undefined"", ""nucleus_segments"": ""undefined"", ""nucleus_shape"": ""undefined"", ""size"": ""undefined"", ""villi"": ""undefined""}",A Myelocyte cell.,A Myelocyte cell.,,
PROMYELOCYTE_878266,Monocyte,PROMYELOCYTE_878266.jpg,PROMYELOCYTE_878266,ig,/content/drive/MyDrive/TFM/blood-cell-vllm/imagenes/ig/PROMYELOCYTE_878266.jpg,promyelocyte,PROMYELOCYTE,monocyte,monocyte,0.957558,A purple and white substance.,A purple and white substance.,0,{},"{""cytoplasm_amount"": ""moderate"", ""cytoplasm_color"": ""grayish"", ""granulation"": ""in fine sand"", ""inclusions"": ""absent"", ""nuclear_chromatin"": ""homogeneous/open/low condensed"", ""nucleocytoplasmic_ratio"": ""moderate"", ""nucleoli"": ""absent"", ""nucleus_segments"": ""mononuclear"", ""nucleus_shape"": ""indented"", ""size"": ""high"", ""villi"": ""absent""}","A Monocyte cell with high size, moderate nucleocytoplasmic ratio, a indented nucleus (mononuclear), homogeneous/open/low condensed chromatin, absent nucleoli, moderate grayish cytoplasm, in fine sand granulation, absent inclusions, and absent villi.","{""confidence"": {""cytoplasm_amount"": 0.95, ""cytoplasm_color"": 0.95, ""granulation"": 0.95, ""inclusions"": 0.95, ""nuclear_chromatin"": 0.95, ""nucleocytoplasmic_ratio"": 0.95, ""nucleoli"": 0.95, ""nucleus_segments"": 0.95, ""nucleus_shape"": 0.95, ""size"": 0.95, ""villi"": 0.95}, ""cytoplasm_amount"": ""moderate"", ""cytoplasm_color"": ""grayish"", ""granulation"": ""in fine sand"", ""inclusions"": ""absent"", ""nuclear_chromatin"": ""homogeneous/open/low condensed"", ""nucleocytoplasmic_ratio"": ""moderate"", ""nucleoli"": ""absent"", ""nucleus_segments"": ""mononuclear"", ""nucleus_shape"": ""indented"", ""size"": ""high"", ""villi"": ""absent""}","A Monocyte cell with high size, moderate nucleocytoplasmic ratio, a indented nucleus (mononuclear), homogeneous/open/low condensed chromatin, absent nucleoli, moderate grayish cytoplasm, in fine sand granulation, absent inclusions, and absent villi.","A Monocyte cell with high size, moderate nucleocytoplasmic ratio, a indented nucleus (mononuclear), homogeneous/open/low condensed chromatin, absent nucleoli, moderate grayish cytoplasm, in fine sand granulation, absent inclusions, and absent villi.",,
PROMYELOCYTE_881672,Myelocyte,PROMYELOCYTE_881672.jpg,PROMYELOCYTE_881672,ig,/content/drive/MyDrive/TFM/blood-cell-vllm/imagenes/ig/PROMYELOCYTE_881672.jpg,promyelocyte,PROMYELOCYTE,myelocyte,myelocyte,0.595469,Purple and white blood cells.,Purple and white blood cells.,0,{},"{""cytoplasm_amount"": ""undefined"", ""cytoplasm_color"": ""undefined"", ""granulation"": ""undefined"", ""inclusions"": ""undefined"", ""nuclear_chromatin"": ""undefined"", ""nucleocytoplasmic_ratio"": ""undefined"", ""nucleoli"": ""undefined"", ""nucleus_segments"": ""undefined"", ""nucleus_shape"": ""undefined"", ""size"": ""undefined"", ""villi"": ""undefined""}",A Myelocyte cell.,"{""confidence"": {""cytoplasm_amount"": 0.4, ""cytoplasm_color"": 0.4, ""granulation"": 0.4, ""inclusions"": 0.4, ""nuclear_chromatin"": 0.4, ""nucleocytoplasmic_ratio"": 0.4, ""nucleoli"": 0.4, ""nucleus_segments"": 0.4, ""nucleus_shape"": 0.4, ""size"": 0.4, ""villi"": 0.4}, ""cytoplasm_amount"": ""undefined"", ""cytoplasm_color"": ""undefined"", ""granulation"": ""undefined"", ""inclusions"": ""undefined"", ""nuclear_chromatin"": ""undefined"", ""nucleocytoplasmic_ratio"": ""undefined"", ""nucleoli"": ""undefined"", ""nucleus_segments"": ""undefined"", ""nucleus_shape"": ""undefined"", ""size"": ""undefined"", ""villi"": ""undefined""}",A Myelocyte cell.,A Myelocyte cell.,,
PROMYELOCYTE_92048,Myelocyte,PROMYELOCYTE_92048.jpg,PROMYELOCYTE_92048,ig,/content/drive/MyDrive/TFM/blood-cell-vllm/imagenes/ig/PROMYELOCYTE_92048.jpg,promyelocyte,PROMYELOCYTE,myelocyte,myelocyte,0.967486,A purple substance in a white background.,A purple substance in a white background.,0,{},"{""cytoplasm_amount"": ""undefined"", ""cytoplasm_color"": ""undefined"", ""granulation"": ""undefined"", ""inclusions"": ""undefined"", ""nuclear_chromatin"": ""undefined"", ""nucleocytoplasmic_ratio"": ""undefined"", ""nucleoli"": ""undefined"", ""nucleus_segments"": ""undefined"", ""nucleus_shape"": ""undefined"", ""size"": ""undefined"", ""villi"": ""undefined""}",A Myelocyte cell.,"{""confidence"": {""cytoplasm_amount"": 0.4, ""cytoplasm_color"": 0.4, ""granulation"": 0.4, ""inclusions"": 0.4, ""nuclear_chromatin"": 0.4, ""nucleocytoplasmic_ratio"": 0.4, ""nucleoli"": 0.4, ""nucleus_segments"": 0.4, ""nucleus_shape"": 0.4, ""size"": 0.4, ""villi"": 0.4}, ""cytoplasm_amount"": ""undefined"", ""cytoplasm_color"": ""undefined"", ""granulation"": ""undefined"", ""inclusions"": ""undefined"", ""nuclear_chromatin"": ""undefined"", ""nucleocytoplasmic_ratio"": ""undefined"", ""nucleoli"": ""undefined"", ""nucleus_segments"": ""undefined"", ""nucleus_shape"": ""undefined"", ""size"": ""undefined"", ""villi"": ""undefined""}",A Myelocyte cell.,A Myelocyte cell.,,
PROMYELOCYTE_924424,Myelocyte,PROMYELOCYTE_924424.jpg,PROMYELOCYTE_924424,ig,/content/drive/MyDrive/TFM/blood-cell-vllm/imagenes/ig/PROMYELOCYTE_924424.jpg,promyelocyte,PROMYELOCYTE,myelocyte,myelocyte,0.522074,A purple substance in a white background.,A purple substance in a white background.,0,{},"{""cytoplasm_amount"": ""undefined"", ""cytoplasm_color"": ""undefined"", ""granulation"": ""undefined"", ""inclusions"": ""undefined"", ""nuclear_chromatin"": ""undefined"", ""nucleocytoplasmic_ratio"": ""undefined"", ""nucleoli"": ""undefined"", ""nucleus_segments"": ""undefined"", ""nucleus_shape"": ""undefined"", ""size"": ""undefined"", ""villi"": ""undefined""}",A Myelocyte cell.,"{""confidence"": {""cytoplasm_amount"": 0.4, ""cytoplasm_color"": 0.4, ""granulation"": 0.4, ""inclusions"": 0.4, ""nuclear_chromatin"": 0.4, ""nucleocytoplasmic_ratio"": 0.4, ""nucleoli"": 0.4, ""nucleus_segments"": 0.4, ""nucleus_shape"": 0.4, ""size"": 0.4, ""villi"": 0.4}, ""cytoplasm_amount"": ""undefined"", ""cytoplasm_color"": ""undefined"", ""granulation"": ""undefined"", ""inclusions"": ""undefined"", ""nuclear_chromatin"": ""undefined"", ""nucleocytoplasmic_ratio"": ""undefined"", ""nucleoli"": ""undefined"", ""nucleus_segments"": ""undefined"", ""nucleus_shape"": ""undefined"", ""size"": ""undefined"", ""villi"": ""undefined""}",A Myelocyte cell.,A Myelocyte cell.,,
PROMYELOCYTE_949421,Myelocyte,PROMYELOCYTE_949421.jpg,PROMYELOCYTE_949421,ig,/content/drive/MyDrive/TFM/blood-cell-vllm/imagenes/ig/PROMYELOCYTE_949421.jpg,promyelocyte,PROMYELOCYTE,myelocyte,myelocyte,0.986067,A close up a purple and white substance.,A close up a purple and white substance.,0,{},"{""cytoplasm_amount"": ""undefined"", ""cytoplasm_color"": ""undefined"", ""granulation"": ""undefined"", ""inclusions"": ""undefined"", ""nuclear_chromatin"": ""undefined"", ""nucleocytoplasmic_ratio"": ""undefined"", ""nucleoli"": ""undefined"", ""nucleus_segments"": ""undefined"", ""nucleus_shape"": ""undefined"", ""size"": ""undefined"", ""villi"": ""undefined""}",A Myelocyte cell.,"{""confidence"": {""cytoplasm_amount"": 0.4, ""cytoplasm_color"": 0.4, ""granulation"": 0.4, ""inclusions"": 0.4, ""nuclear_chromatin"": 0.4, ""nucleocytoplasmic_ratio"": 0.4, ""nucleoli"": 0.4, ""nucleus_segments"": 0.4, ""nucleus_shape"": 0.4, ""size"": 0.4, ""villi"": 0.4}, ""cytoplasm_amount"": ""undefined"", ""cytoplasm_color"": ""undefined"", ""granulation"": ""undefined"", ""inclusions"": ""undefined"", ""nuclear_chromatin"": ""undefined"", ""nucleocytoplasmic_ratio"": ""undefined"", ""nucleoli"": ""undefined"", ""nucleus_segments"": ""undefined"", ""nucleus_shape"": ""undefined"", ""size"": ""undefined"", ""villi"": ""undefined""}",A Myelocyte cell.,A Myelocyte cell.,,
PROMYELOCYTE_995062,Myelocyte,PROMYELOCYTE_995062.jpg,PROMYELOCYTE_995062,ig,/content/drive/MyDrive/TFM/blood-cell-vllm/imagenes/ig/PROMYELOCYTE_995062.jpg,promyelocyte,PROMYELOCYTE,myelocyte,myelocyte,0.721993,A cell membrane with purple and white dots.,A cell membrane with purple and white dots.,0,{},"{""cytoplasm_amount"": ""undefined"", ""cytoplasm_color"": ""undefined"", ""granulation"": ""undefined"", ""inclusions"": ""undefined"", ""nuclear_chromatin"": ""undefined"", ""nucleocytoplasmic_ratio"": ""undefined"", ""nucleoli"": ""undefined"", ""nucleus_segments"": ""undefined"", ""nucleus_shape"": ""undefined"", ""size"": ""undefined"", ""villi"": ""undefined""}",A Myelocyte cell.,"{""confidence"": {""cytoplasm_amount"": 0.4, ""cytoplasm_color"": 0.4, ""granulation"": 0.4, ""inclusions"": 0.4, ""nuclear_chromatin"": 0.4, ""nucleocytoplasmic_ratio"": 0.4, ""nucleoli"": 0.4, ""nucleus_segments"": 0.4, ""nucleus_shape"": 0.4, ""size"": 0.4, ""villi"": 0.4}, ""cytoplasm_amount"": ""undefined"", ""cytoplasm_color"": ""undefined"", ""granulation"": ""undefined"", ""inclusions"": ""undefined"", ""nuclear_chromatin"": ""undefined"", ""nucleocytoplasmic_ratio"": ""undefined"", ""nucleoli"": ""undefined"", ""nucleus_segments"": ""undefined"", ""nucleus_shape"": ""undefined"", ""size"": ""undefined"", ""villi"": ""undefined""}",A Myelocyte cell.,A Myelocyte cell.,,
LYMPHOCYTE_449067,Lymphocyte,LYMPHOCYTE_449067.jpg,LYMPHOCYTE_449067,lymphocyte,/content/drive/MyDrive/TFM/blood-cell-vllm/imagenes/lymphocyte/LYMPHOCYTE_449067.jpg,lymphocyte,LYMPHOCYTE,monocyte,monocyte,0.911733,A close up of a purple and white blood cell.,A close up of a purple and white blood cell.,0,{},"{""cytoplasm_amount"": ""scant"", ""cytoplasm_color"": ""basophilic"", ""granulation"": ""occasional"", ""inclusions"": ""absent"", ""nuclear_chromatin"": ""condensed/heterogeneous"", ""nucleocytoplasmic_ratio"": ""high"", ""nucleoli"": ""absent"", ""nucleus_segments"": ""mononuclear"", ""nucleus_shape"": ""regular"", ""size"": ""small"", ""villi"": ""absent""}","A Lymphocyte cell with small size, high nucleocytoplasmic ratio, a regular nucleus (mononuclear), condensed/heterogeneous chromatin, absent nucleoli, scant basophilic cytoplasm, occasional granulation, absent inclusions, and absent villi.","{""confidence"": {""cytoplasm_amount"": 0.95, ""cytoplasm_color"": 0.95, ""granulation"": 0.95, ""inclusions"": 0.95, ""nuclear_chromatin"": 0.95, ""nucleocytoplasmic_ratio"": 0.95, ""nucleoli"": 0.95, ""nucleus_segments"": 0.95, ""nucleus_shape"": 0.95, ""size"": 0.95, ""villi"": 0.95}, ""cytoplasm_amount"": ""scant"", ""cytoplasm_color"": ""basophilic"", ""granulation"": ""occasional"", ""inclusions"": ""absent"", ""nuclear_chromatin"": ""condensed/heterogeneous"", ""nucleocytoplasmic_ratio"": ""high"", ""nucleoli"": ""absent"", ""nucleus_segments"": ""mononuclear"", ""nucleus_shape"": ""regular"", ""size"": ""small"", ""villi"": ""absent""}","A Lymphocyte cell with small size, high nucleocytoplasmic ratio, a regular nucleus (mononuclear), condensed/heterogeneous chromatin, absent nucleoli, scant basophilic cytoplasm, occasional granulation, absent inclusions, and absent villi.","A Lymphocyte cell with small size, high nucleocytoplasmic ratio, a regular nucleus (mononuclear), condensed/heterogeneous chromatin, absent nucleoli, scant basophilic cytoplasm, occasional granulation, absent inclusions, and absent villi.",,
LYMPHOCYTE_592178,Lymphocyte,LYMPHOCYTE_592178.jpg,LYMPHOCYTE_592178,lymphocyte,/content/drive/MyDrive/TFM/blood-cell-vllm/imagenes/lymphocyte/LYMPHOCYTE_592178.jpg,lymphocyte,LYMPHOCYTE,erythroblast,erythroblast,0.713163,A blue and purple substance in a white background.,A blue and purple substance in a white background.,0,{},"{""cytoplasm_amount"": ""scant"", ""cytoplasm_color"": ""basophilic"", ""granulation"": ""occasional"", ""inclusions"": ""absent"", ""nuclear_chromatin"": ""condensed/heterogeneous"", ""nucleocytoplasmic_ratio"": ""high"", ""nucleoli"": ""absent"", ""nucleus_segments"": ""mononuclear"", ""nucleus_shape"": ""regular"", ""size"": ""small"", ""villi"": ""absent""}","A Lymphocyte cell with small size, high nucleocytoplasmic ratio, a regular nucleus (mononuclear), condensed/heterogeneous chromatin, absent nucleoli, scant basophilic cytoplasm, occasional granulation, absent inclusions, and absent villi.","{""confidence"": {""cytoplasm_amount"": 0.95, ""cytoplasm_color"": 0.95, ""granulation"": 0.95, ""inclusions"": 0.95, ""nuclear_chromatin"": 0.95, ""nucleocytoplasmic_ratio"": 0.95, ""nucleoli"": 0.95, ""nucleus_segments"": 0.95, ""nucleus_shape"": 0.95, ""size"": 0.95, ""villi"": 0.95}, ""cytoplasm_amount"": ""scant"", ""cytoplasm_color"": ""basophilic"", ""granulation"": ""occasional"", ""inclusions"": ""absent"", ""nuclear_chromatin"": ""condensed/heterogeneous"", ""nucleocytoplasmic_ratio"": ""high"", ""nucleoli"": ""absent"", ""nucleus_segments"": ""mononuclear"", ""nucleus_shape"": ""regular"", ""size"": ""small"", ""villi"": ""absent""}","A Lymphocyte cell with small size, high nucleocytoplasmic ratio, a regular nucleus (mononuclear), condensed/heterogeneous chromatin, absent nucleoli, scant basophilic cytoplasm, occasional granulation, absent inclusions, and absent villi.","A Lymphocyte cell with small size, high nucleocytoplasmic ratio, a regular nucleus (mononuclear), condensed/heterogeneous chromatin, absent nucleoli, scant basophilic cytoplasm, occasional granulation, absent inclusions, and absent villi.",,
MONOCYTE_153786,Monocyte,MONOCYTE_153786.jpg,MONOCYTE_153786,monocyte,/content/drive/MyDrive/TFM/blood-cell-vllm/imagenes/monocyte/MONOCYTE_153786.jpg,monocyte,MONOCYTE,promyelocyte,promyelocyte,0.661836,A purple and white cell.,A purple and white cell.,0,{},"{""cytoplasm_amount"": ""moderate"", ""cytoplasm_color"": ""grayish"", ""granulation"": ""in fine sand"", ""inclusions"": ""absent"", ""nuclear_chromatin"": ""homogeneous/open/low condensed"", ""nucleocytoplasmic_ratio"": ""moderate"", ""nucleoli"": ""absent"", ""nucleus_segments"": ""mononuclear"", ""nucleus_shape"": ""indented"", ""size"": ""high"", ""villi"": ""absent""}","A Monocyte cell with high size, moderate nucleocytoplasmic ratio, a indented nucleus (mononuclear), homogeneous/open/low condensed chromatin, absent nucleoli, moderate grayish cytoplasm, in fine sand granulation, absent inclusions, and absent villi.","{""confidence"": {""cytoplasm_amount"": 0.95, ""cytoplasm_color"": 0.95, ""granulation"": 0.95, ""inclusions"": 0.95, ""nuclear_chromatin"": 0.95, ""nucleocytoplasmic_ratio"": 0.95, ""nucleoli"": 0.95, ""nucleus_segments"": 0.95, ""nucleus_shape"": 0.95, ""size"": 0.95, ""villi"": 0.95}, ""cytoplasm_amount"": ""moderate"", ""cytoplasm_color"": ""grayish"", ""granulation"": ""in fine sand"", ""inclusions"": ""absent"", ""nuclear_chromatin"": ""homogeneous/open/low condensed"", ""nucleocytoplasmic_ratio"": ""moderate"", ""nucleoli"": ""absent"", ""nucleus_segments"": ""mononuclear"", ""nucleus_shape"": ""indented"", ""size"": ""high"", ""villi"": ""absent""}","A Monocyte cell with high size, moderate nucleocytoplasmic ratio, a indented nucleus (mononuclear), homogeneous/open/low condensed chromatin, absent nucleoli, moderate grayish cytoplasm, in fine sand granulation, absent inclusions, and absent villi.","A Monocyte cell with high size, moderate nucleocytoplasmic ratio, a indented nucleus (mononuclear), homogeneous/open/low condensed chromatin, absent nucleoli, moderate grayish cytoplasm, in fine sand granulation, absent inclusions, and absent villi.",,
MONOCYTE_189409,Monocyte,MONOCYTE_189409.jpg,MONOCYTE_189409,monocyte,/content/drive/MyDrive/TFM/blood-cell-vllm/imagenes/monocyte/MONOCYTE_189409.jpg,monocyte,MONOCYTE,lymphocyte,lymphocyte,0.979338,A purple substance in a white background.,A purple substance in a white background.,0,{},"{""cytoplasm_amount"": ""moderate"", ""cytoplasm_color"": ""grayish"", ""granulation"": ""in fine sand"", ""inclusions"": ""absent"", ""nuclear_chromatin"": ""homogeneous/open/low condensed"", ""nucleocytoplasmic_ratio"": ""moderate"", ""nucleoli"": ""absent"", ""nucleus_segments"": ""mononuclear"", ""nucleus_shape"": ""indented"", ""size"": ""high"", ""villi"": ""absent""}","A Monocyte cell with high size, moderate nucleocytoplasmic ratio, a indented nucleus (mononuclear), homogeneous/open/low condensed chromatin, absent nucleoli, moderate grayish cytoplasm, in fine sand granulation, absent inclusions, and absent villi.","{""confidence"": {""cytoplasm_amount"": 0.95, ""cytoplasm_color"": 0.95, ""granulation"": 0.95, ""inclusions"": 0.95, ""nuclear_chromatin"": 0.95, ""nucleocytoplasmic_ratio"": 0.95, ""nucleoli"": 0.95, ""nucleus_segments"": 0.95, ""nucleus_shape"": 0.95, ""size"": 0.95, ""villi"": 0.95}, ""cytoplasm_amount"": ""moderate"", ""cytoplasm_color"": ""grayish"", ""granulation"": ""in fine sand"", ""inclusions"": ""absent"", ""nuclear_chromatin"": ""homogeneous/open/low condensed"", ""nucleocytoplasmic_ratio"": ""moderate"", ""nucleoli"": ""absent"", ""nucleus_segments"": ""mononuclear"", ""nucleus_shape"": ""indented"", ""size"": ""high"", ""villi"": ""absent""}","A Monocyte cell with high size, moderate nucleocytoplasmic ratio, a indented nucleus (mononuclear), homogeneous/open/low condensed chromatin, absent nucleoli, moderate grayish cytoplasm, in fine sand granulation, absent inclusions, and absent villi.","A Monocyte cell with high size, moderate nucleocytoplasmic ratio, a indented nucleus (mononuclear), homogeneous/open/low condensed chromatin, absent nucleoli, moderate grayish cytoplasm, in fine sand granulation, absent inclusions, and absent villi.",,
MONOCYTE_692148,Monocyte,MONOCYTE_692148.jpg,MONOCYTE_692148,monocyte,/content/drive/MyDrive/TFM/blood-cell-vllm/imagenes/monocyte/MONOCYTE_692148.jpg,monocyte,MONOCYTE,promyelocyte,promyelocyte,0.663339,A close up of a purple and white substance.,A close up of a purple and white substance.,0,{},"{""cytoplasm_amount"": ""moderate"", ""cytoplasm_color"": ""grayish"", ""granulation"": ""in fine sand"", ""inclusions"": ""absent"", ""nuclear_chromatin"": ""homogeneous/open/low condensed"", ""nucleocytoplasmic_ratio"": ""moderate"", ""nucleoli"": ""absent"", ""nucleus_segments"": ""mononuclear"", ""nucleus_shape"": ""indented"", ""size"": ""high"", ""villi"": ""absent""}","A Monocyte cell with high size, moderate nucleocytoplasmic ratio, a indented nucleus (mononuclear), homogeneous/open/low condensed chromatin, absent nucleoli, moderate grayish cytoplasm, in fine sand granulation, absent inclusions, and absent villi.","{""confidence"": {""cytoplasm_amount"": 0.95, ""cytoplasm_color"": 0.95, ""granulation"": 0.95, ""inclusions"": 0.95, ""nuclear_chromatin"": 0.95, ""nucleocytoplasmic_ratio"": 0.95, ""nucleoli"": 0.95, ""nucleus_segments"": 0.95, ""nucleus_shape"": 0.95, ""size"": 0.95, ""villi"": 0.95}, ""cytoplasm_amount"": ""moderate"", ""cytoplasm_color"": ""grayish"", ""granulation"": ""in fine sand"", ""inclusions"": ""absent"", ""nuclear_chromatin"": ""homogeneous/open/low condensed"", ""nucleocytoplasmic_ratio"": ""moderate"", ""nucleoli"": ""absent"", ""nucleus_segments"": ""mononuclear"", ""nucleus_shape"": ""indented"", ""size"": ""high"", ""villi"": ""absent""}","A Monocyte cell with high size, moderate nucleocytoplasmic ratio, a indented nucleus (mononuclear), homogeneous/open/low condensed chromatin, absent nucleoli, moderate grayish cytoplasm, in fine sand granulation, absent inclusions, and absent villi.","A Monocyte cell with high size, moderate nucleocytoplasmic ratio, a indented nucleus (mononuclear), homogeneous/open/low condensed chromatin, absent nucleoli, moderate grayish cytoplasm, in fine sand granulation, absent inclusions, and absent villi.",,
MONOCYTE_799197,Monocyte,MONOCYTE_799197.jpg,MONOCYTE_799197,monocyte,/content/drive/MyDrive/TFM/blood-cell-vllm/imagenes/monocyte/MONOCYTE_799197.jpg,monocyte,MONOCYTE,basophil,basophil,0.89881,A purple substance in a white background.,A purple substance in a white background.,0,{},"{""cytoplasm_amount"": ""moderate"", ""cytoplasm_color"": ""grayish"", ""granulation"": ""in fine sand"", ""inclusions"": ""absent"", ""nuclear_chromatin"": ""homogeneous/open/low condensed"", ""nucleocytoplasmic_ratio"": ""moderate"", ""nucleoli"": ""absent"", ""nucleus_segments"": ""mononuclear"", ""nucleus_shape"": ""indented"", ""size"": ""high"", ""villi"": ""absent""}","A Monocyte cell with high size, moderate nucleocytoplasmic ratio, a indented nucleus (mononuclear), homogeneous/open/low condensed chromatin, absent nucleoli, moderate grayish cytoplasm, in fine sand granulation, absent inclusions, and absent villi.","{""confidence"": {""cytoplasm_amount"": 0.95, ""cytoplasm_color"": 0.95, ""granulation"": 0.95, ""inclusions"": 0.95, ""nuclear_chromatin"": 0.95, ""nucleocytoplasmic_ratio"": 0.95, ""nucleoli"": 0.95, ""nucleus_segments"": 0.95, ""nucleus_shape"": 0.95, ""size"": 0.95, ""villi"": 0.95}, ""cytoplasm_amount"": ""moderate"", ""cytoplasm_color"": ""grayish"", ""granulation"": ""in fine sand"", ""inclusions"": ""absent"", ""nuclear_chromatin"": ""homogeneous/open/low condensed"", ""nucleocytoplasmic_ratio"": ""moderate"", ""nucleoli"": ""absent"", ""nucleus_segments"": ""mononuclear"", ""nucleus_shape"": ""indented"", ""size"": ""high"", ""villi"": ""absent""}","A Monocyte cell with high size, moderate nucleocytoplasmic ratio, a indented nucleus (mononuclear), homogeneous/open/low condensed chromatin, absent nucleoli, moderate grayish cytoplasm, in fine sand granulation, absent inclusions, and absent villi.","A Monocyte cell with high size, moderate nucleocytoplasmic ratio, a indented nucleus (mononuclear), homogeneous/open/low condensed chromatin, absent nucleoli, moderate grayish cytoplasm, in fine sand granulation, absent inclusions, and absent villi.",,
BAND_119542,Neutrophil Band,BAND_119542.jpg,BAND_119542,neutrophil,/content/drive/MyDrive/TFM/blood-cell-vllm/imagenes/neutrophil/BAND_119542.jpg,band,NEUTROPHIL - BAND,segmented,segmented,0.739017,A purple and white cell.,A purple and white cell.,0,{},"{""cytoplasm_amount"": ""wide"", ""cytoplasm_color"": ""azurophilic"", ""granulation"": ""azurophil"", ""inclusions"": ""absent"", ""nuclear_chromatin"": ""condensed/heterogeneous"", ""nucleocytoplasmic_ratio"": ""low"", ""nucleoli"": ""absent"", ""nucleus_segments"": ""0"", ""nucleus_shape"": ""band"", ""size"": ""intermediate"", ""villi"": ""absent""}","A Neutrophil Band cell with intermediate size, low nucleocytoplasmic ratio, a band nucleus (0), condensed/heterogeneous chromatin, absent nucleoli, wide azurophilic cytoplasm, azurophil granulation, absent inclusions, and absent villi.","{""confidence"": {""cytoplasm_amount"": 0.95, ""cytoplasm_color"": 0.95, ""granulation"": 0.95, ""inclusions"": 0.95, ""nuclear_chromatin"": 0.95, ""nucleocytoplasmic_ratio"": 0.95, ""nucleoli"": 0.95, ""nucleus_segments"": 0.95, ""nucleus_shape"": 0.95, ""size"": 0.95, ""villi"": 0.95}, ""cytoplasm_amount"": ""wide"", ""cytoplasm_color"": ""azurophilic"", ""granulation"": ""azurophil"", ""inclusions"": ""absent"", ""nuclear_chromatin"": ""condensed/heterogeneous"", ""nucleocytoplasmic_ratio"": ""low"", ""nucleoli"": ""absent"", ""nucleus_segments"": ""0"", ""nucleus_shape"": ""band"", ""size"": ""intermediate"", ""villi"": ""absent""}","A Neutrophil Band cell with intermediate size, low nucleocytoplasmic ratio, a band nucleus (0), condensed/heterogeneous chromatin, absent nucleoli, wide azurophilic cytoplasm, azurophil granulation, absent inclusions, and absent villi.","A Neutrophil Band cell with intermediate size, low nucleocytoplasmic ratio, a band nucleus (0), condensed/heterogeneous chromatin, absent nucleoli, wide azurophilic cytoplasm, azurophil granulation, absent inclusions, and absent villi.",,
